{
  "contract_version": "ao.atlas.stack-instance.v0.1",
  "id": "ao-stack-golden-path-month3-v01",
  "state_root": ".atlas-local/state",
  "toolchain_root": "../shared-ao-toolchain",
  "roots": {
    "mission": ".atlas-local/state/ao-stack-golden-path-month3-v01/mission",
    "workgraph": ".atlas-local/state/ao-stack-golden-path-month3-v01/workgraph",
    "context": ".atlas-local/state/ao-stack-golden-path-month3-v01/context",
    "evidence": ".atlas-local/state/ao-stack-golden-path-month3-v01/evidence",
    "worktree": ".atlas-local/state/ao-stack-golden-path-month3-v01/worktree"
  }
}
